{"base_state_version":2,"certifies_completion":false,"criterion_observations":[{"criterion_id":"criterion-001","evidence_item_ids":[],"reason":"The trusted package contains no evidence_refs. Without any submitted evidence items (e.g., test scripts, output logs, or assertion files), it is impossible to verify that the test uses a fixed input and asserts the expected result. Provide at least one evidence item demonstrating the deterministic test input and its asserted output.","status":"needs_more_evidence"}],"feedback_type":"coach_feedback","missing_evidence":["A test script or configuration file showing the fixed input values used in the deterministic workflow test.","An output log or assertion file demonstrating the expected result that the test asserts against."],"program_id":"42fec130-9e27-4a01-9e0b-ac7d6b9b5403","revision_suggestion":"Consider submitting a minimal test artifact (such as a script or config) that clearly defines the fixed input, along with an output or assertion file capturing the expected result. This would allow verification of criterion-001 without requiring additional review cycles.","task_id":"06cdb489-9ad3-55ee-bc03-50d2874dbbeb","task_version":1}
